{
  "meta": {
    "subject": "微生物學與臨床微生物學（包括細菌與黴菌）",
    "source": "Mahon Textbook of Diagnostic Microbiology；Murray Medical Microbiology；考選部醫檢師考題（民國101-114年完整年度，及115年第一次試卷）",
    "clinical_systems": [
      "呼吸道",
      "腸道",
      "泌尿",
      "血流",
      "CNS",
      "STI",
      "皮膚軟組織",
      "周邊神經"
    ],
    "version": "1.3.0",
    "updated": "2026-06-17"
  },
  "flows": {
    "革蘭氏陽性球菌（G⁺ Cocci）": [
      "Gram → G⁺ 球菌 → **Catalase**",
      "├ **(+)** Staphylococcus（葡萄串）→ **Coagulase**：(+) S. aureus／(−) CoNS → **Novobiocin**：R→saprophyticus、S→epidermidis",
      "└ **(−)** Streptococcus／Enterococcus（鏈狀）→ **BAP 溶血**",
      "    ├ β：bacitracin-S,PYR(+)→A群 pyogenes；CAMP(+)→B群 agalactiae",
      "    ├ α：optochin-S,膽溶(+)→pneumoniae；optochin-R→viridans",
      "    └ γ：bile esculin+6.5%NaCl+PYR 三(+)→Enterococcus"
    ],
    "革蘭氏陽性桿菌（G⁺ Bacilli）": [
      "Gram → G⁺ 桿菌 → 是否**分枝絲狀**？",
      "├ 分枝絲狀：弱抗酸(+)、好氧 → **Nocardia**；非抗酸、厭氧、硫磺顆粒 → **Actinomyces**",
      "└ 規則桿菌 → 是否**產芽孢**？",
      "    ├ 產孢：需氧/兼性 → **Bacillus**（anthracis 非動性/cereus 動性）；厭氧 → **Clostridium**",
      "    └ 不產孢 → **Catalase**：(+) Listeria（tumbling）／Corynebacterium（異染顆粒）；(−) Lactobacillus／Erysipelothrix(H₂S+)"
    ],
    "抗酸菌（Acid-fast Bacteria）": [
      "抗酸染色(AFB,Ziehl-Neelsen) (+) → Mycobacterium",
      "├ 生長慢、niacin(+)、cord factor → **M. tuberculosis**",
      "├ 不可培養、嗜低溫 → **M. leprae**",
      "└ 環境菌(NTM)，依 Runyon 產色/生長速率分類 → **M. avium complex** 等"
    ],
    "革蘭氏陰性球菌／球桿菌（G⁻ Cocci / Coccobacilli）": [
      "G⁻ → **Oxidase(+)** 雙球菌 → Neisseria／Moraxella",
      "├ 醣發酵：只 glucose → **N. gonorrhoeae**；glucose+maltose → **N. meningitidis**；不發酵糖、DNase(+) → **Moraxella**",
      "└ 小球桿菌（苛養）：需 X+V 因子 → **Haemophilus**；Bordet-Gengou → **Bordetella**；胞內人畜共通 → **Brucella／Francisella／Pasteurella**"
    ],
    "革蘭氏陰性桿菌（G⁻ Bacilli）": [
      "G⁻ 桿菌 → **Oxidase**",
      "├ **(−)** → 發酵 glucose？",
      "│   ├ 發酵（**腸桿菌目**）→ lactose：(+) E.coli/Klebsiella；(−) → H₂S(+) Salmonella/Proteus、H₂S(−) Shigella",
      "│   └ 不發酵 → **Acinetobacter**(oxidase−)／**Stenotrophomonas**(SXT)",
      "└ **(+)** → 非發酵 **Pseudomonas／Burkholderia**；彎曲 **Vibrio／Campylobacter／Helicobacter**；苛養 **Legionella**(BCYE)；厭氧 **Bacteroides**"
    ],
    "螺旋體（Spirochetes）": [
      "螺旋形、暗視野顯微鏡觀察",
      "├ 不可培養、細密螺旋 → **Treponema pallidum**（梅毒）",
      "├ 較大、可 Giemsa 染、節肢媒介 → **Borrelia**（萊姆/回歸熱）",
      "└ 末端鉤狀、EMJH 培養 → **Leptospira**（鉤端螺旋體病）"
    ],
    "非典型／胞內菌（Atypical / Intracellular）": [
      "細胞壁/培養特性異常",
      "├ **無細胞壁**（β-lactam 無效）→ **Mycoplasma**；urease(+) → **Ureaplasma**",
      "└ **絕對胞內** → 含包涵體 **Chlamydia**；節肢媒介 Weil-Felix **Rickettsia**；氣溶膠 **Coxiella**；桑椹體 **Ehrlichia/Anaplasma**"
    ]
  },
  "species": [
    {
      "h1": "革蘭氏陽性球菌（G⁺ Cocci）",
      "h2": "Staphylococcus（葡萄球菌）",
      "zh": "金黃色葡萄球菌",
      "en": "Staphylococcus aureus",
      "stars": 3,
      "sys": [
        "皮膚軟組織",
        "血流",
        "呼吸道",
        "腸道"
      ],
      "morph": "G⁺ 球菌，**葡萄串狀**排列；無芽孢、無動性。",
      "oxy": "兼性厭氧；**catalase(+)**、oxidase(−)。",
      "media": "MSA：發酵甘露醇→黃色；BAP：金黃、**β溶血**。",
      "tests": "**Coagulase(+)**(slide=clumping factor／tube=free)；thermostable DNase(+)；mannitol(+)；novobiocin-S。",
      "vir": "protein A、coagulase、TSST-1、腸毒素(耐熱)、exfoliative toxin、PVL、α-toxin。",
      "dis": "皮膚軟組織感染、菌血症/心內膜炎、骨髓炎、肺炎、**食物中毒**(嘔吐型,1–6h)、TSS、SSSS。",
      "resist": "**MRSA**：mecA→PBP2a；偵測 gold standard＝mecA(或 cefoxitin)。",
      "hot": [
        "coagulase(+) 為與 CoNS 分界",
        "thermostable DNase 與 coagulase 高度一致",
        "MRSA＝mecA→PBP2a",
        "易混淆 S. lugdunensis slide(+)/tube(−)"
      ],
      "qa": [
        [
          "113年 第17題",
          "心內膜炎株 slide(+)/tube(−)、mecA、ornithine(+)→鑑別 S. lugdunensis"
        ],
        [
          "109年 第33題",
          "coagulase 對熱穩定、具抗原性"
        ],
        [
          "104年 第16/18題",
          "gold standard＝mecA；與 coagulase 一致＝thermostable DNase"
        ]
      ]
    },
    {
      "h1": "革蘭氏陽性球菌（G⁺ Cocci）",
      "h2": "Staphylococcus（葡萄球菌）",
      "zh": "表皮葡萄球菌",
      "en": "Staphylococcus epidermidis",
      "stars": 2,
      "sys": [
        "血流"
      ],
      "morph": "G⁺ 球菌，葡萄串狀；CoNS 代表。",
      "oxy": "兼性厭氧；**catalase(+)**。",
      "media": "BAP：白色非溶血；MSA：不發酵甘露醇。",
      "tests": "**Coagulase(−)**；**novobiocin-S**；DNase(−)。",
      "vir": "**生物膜(biofilm/slime)**附著人工裝置。",
      "dis": "導管/人工瓣膜/人工關節感染、菌血症(需判讀污染)。",
      "resist": "常 methicillin-resistant(mecA)。",
      "hot": [
        "CoNS 代表",
        "與 saprophyticus 區分：novobiocin S/R",
        "biofilm 為人工裝置感染關鍵"
      ],
      "qa": [
        [
          "109年 醫學(二) 第6題",
          "catalase 無法區分 aureus/epidermidis；coagulase、mannitol、溶血可"
        ]
      ]
    },
    {
      "h1": "革蘭氏陽性球菌（G⁺ Cocci）",
      "h2": "Staphylococcus（葡萄球菌）",
      "zh": "腐生葡萄球菌",
      "en": "Staphylococcus saprophyticus",
      "stars": 2,
      "sys": [
        "泌尿"
      ],
      "morph": "G⁺ 球菌，葡萄串狀；CoNS。",
      "oxy": "兼性厭氧；**catalase(+)**。",
      "media": "BAP：白色非溶血。",
      "tests": "**Coagulase(−)**；**novobiocin-R**；**urease(+)**；PYR(−)。",
      "vir": "表面蛋白附著尿路上皮。",
      "dis": "**年輕女性**急性膀胱炎(社區 UTI 第二常見)。",
      "resist": "對 novobiocin 天然抗藥。",
      "hot": [
        "novobiocin-R 為關鍵",
        "年輕女性 UTI",
        "尿液 catalase+/coag−/novobiocin-R→本菌"
      ],
      "qa": [
        [
          "102年 第19題",
          "尿液 coag(−)、novobiocin 抗藥→saprophyticus"
        ],
        [
          "106年 第26題",
          "年輕女性 UTI 葡萄球菌"
        ],
        [
          "114年 第11題",
          "分離本菌最不適用 MacConkey"
        ]
      ]
    },
    {
      "h1": "革蘭氏陽性球菌（G⁺ Cocci）",
      "h2": "Streptococcus（鏈球菌）",
      "zh": "化膿性鏈球菌（A群,GAS）",
      "en": "Streptococcus pyogenes",
      "stars": 3,
      "sys": [
        "皮膚軟組織",
        "呼吸道",
        "血流"
      ],
      "morph": "G⁺ 球菌，**鏈狀**；Lancefield **A群**。",
      "oxy": "兼性厭氧；**catalase(−)**。",
      "media": "BAP：**大範圍β溶血**。",
      "tests": "β溶血；**bacitracin-S**；**PYR(+)**；CAMP(−)；SXT-R。",
      "vir": "**M protein**(抗吞噬/分子相似)、streptolysin O(ASO)/S、streptokinase、DNase B、SpeA/C(超抗原)。",
      "dis": "咽喉炎、猩紅熱、丹毒、壞死性筋膜炎、STSS；後遺症**風濕熱/腎絲球腎炎**。",
      "resist": "penicillin 仍敏感。",
      "hot": [
        "bacitracin-S+PYR(+) 為 A群",
        "streptolysin O 氧敏感/ASO；S 造表面溶血",
        "M protein→風濕熱",
        "與 anginosus(PYR−/VP+) 區分"
      ],
      "qa": [
        [
          "103年 第13題",
          "β溶血、bacitracin-S、PYR(+)→A群"
        ],
        [
          "111年 第16題",
          "M protein 與心肌抗原相似→風濕熱"
        ],
        [
          "104年 第14題",
          "BAP 表面溶血＝streptolysin S"
        ]
      ]
    },
    {
      "h1": "革蘭氏陽性球菌（G⁺ Cocci）",
      "h2": "Streptococcus（鏈球菌）",
      "zh": "無乳鏈球菌（B群,GBS）",
      "en": "Streptococcus agalactiae",
      "stars": 3,
      "sys": [
        "血流",
        "CNS",
        "泌尿"
      ],
      "morph": "G⁺ 球菌，鏈狀；Lancefield **B群**。",
      "oxy": "兼性厭氧；**catalase(−)**。",
      "media": "BAP：**窄β溶血**；NGM 橘紅色素；孕婦篩檢 **LIM broth**。",
      "tests": "β溶血(窄)；**CAMP(+)箭頭狀**；**hippurate(+)**；bacitracin-R；PYR(−)。",
      "vir": "**莢膜多醣**(分型/抗吞噬)、CAMP factor。",
      "dis": "**新生兒**敗血症/腦膜炎、孕產婦感染。",
      "resist": "penicillin 敏感；孕婦 35–37 週篩檢。",
      "hot": [
        "CAMP 箭頭狀(vs Listeria block)",
        "hippurate(+)",
        "莢膜多醣為分型依據",
        "LIM broth 篩檢"
      ],
      "qa": [
        [
          "107年 第8題",
          "CAMP 箭頭狀;Listeria block"
        ],
        [
          "107年 第5題",
          "分型依據＝capsular polysaccharide"
        ],
        [
          "106年 第22題",
          "孕婦篩檢增菌＝LIM broth"
        ]
      ]
    },
    {
      "h1": "革蘭氏陽性球菌（G⁺ Cocci）",
      "h2": "Streptococcus（鏈球菌）",
      "zh": "肺炎鏈球菌",
      "en": "Streptococcus pneumoniae",
      "stars": 3,
      "sys": [
        "呼吸道",
        "CNS",
        "血流"
      ],
      "morph": "G⁺ **矛尖狀雙球菌**，具**莢膜**。",
      "oxy": "兼性厭氧；**catalase(−)**。",
      "media": "BAP：**α溶血**，菌落中央凹陷(autolysin)。",
      "tests": "α溶血；**optochin-S(≥14mm)**；**bile solubility(+)**；bile esculin(−)；Quellung 分型。",
      "vir": "**莢膜多醣**(最重要,>90 血清型)、pneumolysin、IgA protease。",
      "dis": "社區型肺炎、成人腦膜炎、中耳炎、菌血症。",
      "resist": "penicillin 抗性＝**PBP 改變**(非 β-lactamase)；疫苗 PCV13/PPSV23。",
      "hot": [
        "optochin-S+膽溶(+) 為與 viridans 分界",
        "Quellung 分型",
        "菌落凹陷=autolysis",
        "抗藥=PBP 改變"
      ],
      "qa": [
        [
          "107年 第14題",
          "optochin 後以 bile solubility 確認"
        ],
        [
          "108年 第29題",
          "optochin-S、膽溶(+)、bile esculin(−)、SXT-R"
        ],
        [
          "111年 第13題",
          "培養過久 autolysis"
        ]
      ]
    },
    {
      "h1": "革蘭氏陽性球菌（G⁺ Cocci）",
      "h2": "Streptococcus（鏈球菌）",
      "zh": "草綠色鏈球菌（群）",
      "en": "Viridans streptococci",
      "stars": 2,
      "sys": [
        "血流",
        "皮膚軟組織"
      ],
      "morph": "G⁺ 球菌，鏈狀；含 mitis/sanguinis/mutans/anginosus/bovis 群。",
      "oxy": "兼性厭氧；**catalase(−)**。",
      "media": "BAP：**α或不溶血**，不凹陷。",
      "tests": "α/γ溶血；**optochin-R**；**bile solubility(−)**；多不耐 6.5%NaCl。",
      "vir": "葡聚糖附著瓣膜/牙齒。",
      "dis": "**亞急性心內膜炎**(sanguinis/mitis)、**齲齒**(mutans)、膿瘍(anginosus)。",
      "resist": "bovis 群帶 D群抗原、與大腸癌相關(已更名 S. gallolyticus)。",
      "hot": [
        "optochin-R+膽不溶 與 pneumoniae 區分",
        "mutans→齲齒;anginosus→膿瘍",
        "bovis 菌血症警覺大腸癌"
      ],
      "qa": [
        [
          "108年 第31題",
          "viridans 為正常菌叢、α/γ溶血、可致菌血症"
        ],
        [
          "110年 第20題",
          "帶 D群抗原者＝S. bovis group"
        ],
        [
          "112年 第19題",
          "BAP 不長→Abiotrophia/Granulicatella"
        ]
      ]
    },
    {
      "h1": "革蘭氏陽性球菌（G⁺ Cocci）",
      "h2": "Enterococcus（腸球菌）",
      "zh": "腸球菌（糞/屎腸球菌）",
      "en": "Enterococcus faecalis / faecium",
      "stars": 3,
      "sys": [
        "泌尿",
        "血流",
        "腸道"
      ],
      "morph": "G⁺ 球菌，成對/短鏈；Lancefield **D群**。",
      "oxy": "兼性厭氧；**catalase(−)**。",
      "media": "bile esculin azide→黑色；6.5%NaCl→生長。",